"Rank","EntryId","EntryName","TimeRemaining","Points","Lineup","X","Player","Roster.Position","X.Drafted","FPTS"
802,967010813,"damavrck",0,257.75,"SF Carmelo Anthony PG Russell Westbrook PF Jordan Mickey UTIL Dennis Smith Jr. SG James Harden F Jamil Wilson C John Henson G Malcolm Brogdon",NA,"","","",NA
806,966701326,"claytonwaves",0,257.5,"F Wayne Ellington PF Kelly Olynyk UTIL Dwight Powell SG Dennis Smith Jr. C Nene Hilario PG James Harden G Eric Gordon SF Giannis Antetokounmpo",NA,"","","",NA
806,967009498,"chefcurry68 (6/20)",0,257.5,"F Carmelo Anthony SG Marco Belinelli SF Paul George PF Bam Adebayo UTIL P.J. Tucker G Trevor Ariza PG James Harden C Dwight Howard",NA,"","","",NA
806,967009505,"chefcurry68 (13/20)",0,257.5,"PG Russell Westbrook G Marco Belinelli SF Paul George UTIL P.J. Tucker F Trevor Ariza PF Ryan Anderson SG Eric Gordon C Dwight Howard",NA,"","","",NA
809,966675341,"edz2015 (5/8)",0,257.25,"G Raymond Felton PG Russell Westbrook UTIL Jerami Grant PF Dwight Powell SG James Harden C Tarik Black F Johnny O'Bryant III SF Giannis Antetokounmpo",NA,"","","",NA
809,967071069,"Rizzle",0,257.25,"SG Kent Bazemore SF Taurean Prince F Kelly Olynyk PG Tyler Johnson C Jordan Mickey G James Harden UTIL DeAndre Jordan PF Sam Dekker",NA,"","","",NA
811,966570326,"perilous (19/20)",0,257,"SF Carmelo Anthony G Kent Bazemore UTIL Wesley Matthews PF Kelly Olynyk SG James Harden PG Kemba Walker C John Henson F Jeremy Lamb",NA,"","","",NA
811,966830972,"prince108 (1/2)",0,257,"UTIL Patrick Patterson PF Jordan Mickey C Nene Hilario SG Lou Williams PG James Harden G Austin Rivers F Montrezl Harrell SF Giannis Antetokounmpo",NA,"","","",NA
811,966921776,"jackthomas12",0,257,"PF Jordan Mickey C Nene Hilario G Trevor Ariza UTIL Lou Williams SG James Harden SF Jamil Wilson PG Kemba Walker F Khris Middleton",NA,"","","",NA
811,967046773,"PMatys (2/2)",0,257,"PF Dirk Nowitzki SG Wesley Matthews UTIL Dwight Powell PG James Harden C DeAndre Jordan F Frank Kaminsky SF Giannis Antetokounmpo G Malik Monk",NA,"","","",NA
815,966873456,"dougal0830",0,256.75,"F Carmelo Anthony UTIL Luke Babbitt PF Harrison Barnes G Dennis Smith Jr. PG James Harden C DeAndre Jordan SG Eric Gordon SF Jeremy Lamb",NA,"","","",NA
816,966570324,"perilous (17/20)",0,256.25,"PF Kelly Olynyk F Dion Waiters G Tyler Johnson UTIL Trevor Ariza SG Lou Williams PG James Harden C John Henson SF Michael Kidd-Gilchrist",NA,"","","",NA
816,966751152,"Petieman",0,256.25,"SF Paul George UTIL Dirk Nowitzki PF Harrison Barnes SG Eric Gordon C Dwight Howard PG Kemba Walker G Eric Bledsoe F Jeremy Lamb",NA,"","","",NA
816,966784469,"batman8964",0,256.25,"PG Russell Westbrook SF Paul George PF Jordan Mickey G Dennis Smith Jr. UTIL Trevor Ariza SG Eric Gordon F Khris Middleton C Frank Kaminsky",NA,"","","",NA
819,966439061,"JamesK27",0,256,"F Ersan Ilyasova PF John Collins SF Dion Waiters UTIL Dennis Smith Jr. SG James Harden PG Austin Rivers C Dwight Howard G Malcolm Brogdon",NA,"","","",NA
819,966567799,"Dallas0827 (5/5)",0,256,"SF Paul George F Kelly Olynyk PG Tyler Johnson PF P.J. Tucker UTIL Trevor Ariza G James Harden SG Eric Gordon C John Henson",NA,"","","",NA
819,966582539,"123...Infinity (16/20)",0,256,"PF Carmelo Anthony SF Andre Roberson PG Dennis Schroder C Nene Hilario SG James Harden F Nicolas Batum UTIL Kemba Walker G Eric Bledsoe",NA,"","","",NA
819,966674415,"forrestkoba (7/20)",0,256,"SF Paul George SG Tyler Johnson F Josh Richardson G Dennis Smith Jr. PF P.J. Tucker UTIL Trevor Ariza PG James Harden C John Henson",NA,"","","",NA
819,966708678,"Sheed_Gotti",0,256,"SF Paul George PF Kelly Olynyk G Tyler Johnson F P.J. Tucker UTIL Trevor Ariza PG James Harden SG Eric Gordon C John Henson",NA,"","","",NA
819,966773096,"blazeman8 (9/20)",0,256,"UTIL Carmelo Anthony SF Paul George PF Kelly Olynyk F P.J. Tucker G Trevor Ariza PG James Harden SG Eric Gordon C John Henson",NA,"","","",NA
819,966773097,"blazeman8 (10/20)",0,256,"SF Paul George PF Kelly Olynyk PG Tyler Johnson F P.J. Tucker UTIL Trevor Ariza G James Harden SG Eric Gordon C John Henson",NA,"","","",NA
819,966962042,"scjeez (9/20)",0,256,"PF Carmelo Anthony F Paul George C Kelly Olynyk SF P.J. Tucker SG Trevor Ariza PG James Harden G Eric Gordon UTIL John Henson",NA,"","","",NA
819,966998317,"Blacknickluas",0,256,"G Russell Westbrook PG Dennis Smith Jr. F Maxi Kleber PF P.J. Tucker C Ryan Anderson SG James Harden UTIL Eric Gordon SF Jamil Wilson",NA,"","","",NA
819,967009500,"chefcurry68 (8/20)",0,256,"F Carmelo Anthony SF Paul George PF Kelly Olynyk UTIL P.J. Tucker G Trevor Ariza PG James Harden SG Eric Gordon C John Henson",NA,"","","",NA
829,966530511,"knuckles3159",0,255.75,"SF Carmelo Anthony UTIL Josh McRoberts F Dwight Powell G Lou Williams PF Ryan Anderson PG James Harden C Dwight Howard SG Khris Middleton",NA,"","","",NA
829,966918227,"gohorns78",0,255.75,"C Kelly Olynyk SF Harrison Barnes G Tyler Johnson F Josh Richardson PF Bam Adebayo PG Lou Williams UTIL Dwight Howard SG Khris Middleton",NA,"","","",NA
831,966792573,"ntc101",0,255.5,"SF Andre Roberson UTIL John Collins G Wayne Ellington C Kelly Olynyk SG Trevor Ariza PG James Harden F Jamil Wilson PF Giannis Antetokounmpo",NA,"","","",NA
832,966732786,"cuda6bbl (1/2)",0,255.25,"UTIL Tyler Johnson G Dennis Smith Jr. F Maxi Kleber SG James Harden PG Malcolm Brogdon SF Michael Kidd-Gilchrist C Frank Kaminsky PF Giannis Antetokounmpo",NA,"","","",NA
832,966964558,"Kramer961",0,255.25,"PF Kelly Olynyk PG Tyler Johnson F Jordan Mickey SF P.J. Tucker SG James Harden G Eric Gordon UTIL Austin Rivers C Dwight Howard",NA,"","","",NA
832,967045986,"scottv215",0,255.25,"G Russell Westbrook PF Kelly Olynyk PG Tyler Johnson UTIL Dennis Smith Jr. C Nene Hilario SG James Harden SF Jamil Wilson F Frank Kaminsky",NA,"","","",NA
835,966545970,"Redfisher1986",0,255,"SF Paul George C Steven Adams PF Kelly Olynyk UTIL Tyler Johnson F Trevor Ariza PG James Harden G Tony Snell SG Malcolm Brogdon",NA,"","","",NA
835,966594896,"mrcse13 (1/20)",0,255,"F Carmelo Anthony SG Kent Bazemore SF Paul George C Jordan Mickey PF P.J. Tucker UTIL Trevor Ariza PG James Harden G Eric Gordon",NA,"","","",NA
835,966604787,"mrcse13 (9/20)",0,255,"F Carmelo Anthony SG Kent Bazemore SF Paul George C Jordan Mickey PF P.J. Tucker UTIL Trevor Ariza PG James Harden G Eric Gordon",NA,"","","",NA
835,966875143,"AlanDavidCook23",0,255,"PG Russell Westbrook SG Taurean Prince C Kelly Olynyk SF Harrison Barnes F Trevor Ariza PF Marvin Williams G Kemba Walker UTIL John Henson",NA,"","","",NA
835,966962046,"scjeez (13/20)",0,255,"SF Carmelo Anthony PG Russell Westbrook F Paul George UTIL John Collins PF Kelly Olynyk C Nene Hilario SG Trevor Ariza G Eric Gordon",NA,"","","",NA
835,967054996,"ame73",0,255,"SF Paul George C John Collins G Dennis Smith Jr. F P.J. Tucker PG Austin Rivers UTIL John Henson SG Khris Middleton PF Giannis Antetokounmpo",NA,"","","",NA
835,967065485,"bucksnake",0,255,"F Paul George PF John Collins SG Wayne Ellington G Josh Richardson SF P.J. Tucker PG James Harden UTIL Dwight Howard C John Henson",NA,"","","",NA
842,966570317,"perilous (10/20)",0,254.75,"G Dion Waiters PF Bam Adebayo UTIL Nene Hilario SF P.J. Tucker F Trevor Ariza SG James Harden C DeAndre Jordan PG Kemba Walker",NA,"","","",NA
842,966965615,"atramm",0,254.75,"PF Carmelo Anthony C Kelly Olynyk PG Tyler Johnson SG Josh Richardson F P.J. Tucker SF Trevor Ariza G Eric Gordon UTIL Giannis Antetokounmpo",NA,"","","",NA
844,966674421,"forrestkoba (13/20)",0,254.5,"SF Wayne Ellington F Kelly Olynyk UTIL Josh Richardson G Dennis Smith Jr. PF P.J. Tucker PG James Harden SG Eric Gordon C Dwight Howard",NA,"","","",NA
844,966764470,"zachdaddy (9/10)",0,254.5,"SF Paul George F Kelly Olynyk PG Tyler Johnson C Nene Hilario PF P.J. Tucker SG Trevor Ariza G James Harden UTIL Kemba Walker",NA,"","","",NA
844,966814682,"jcollard27 (1/2)",0,254.5,"PF Dirk Nowitzki G Yogi Ferrell F Jordan Mickey PG James Harden SG Eric Gordon UTIL Jamil Wilson C John Henson SF Giannis Antetokounmpo",NA,"","","",NA
844,966962045,"scjeez (12/20)",0,254.5,"F Carmelo Anthony PG Russell Westbrook PF Kelly Olynyk C Nene Hilario SF P.J. Tucker SG Trevor Ariza UTIL DeAndre Jordan G Eric Gordon",NA,"","","",NA
844,967023043,"SWBgovols16",0,254.5,"UTIL Miles Plumlee SF Paul George C Steven Adams PF Kelly Olynyk SG Josh Richardson PG James Harden G Eric Gordon F Tony Snell",NA,"","","",NA
844,967037712,"Diggy1984 (2/2)",0,254.5,"PG Russell Westbrook UTIL Taurean Prince G Tyler Johnson SG Josh Richardson PF P.J. Tucker SF Trevor Ariza C DeAndre Jordan F Montrezl Harrell",NA,"","","",NA
850,966674413,"forrestkoba (5/20)",0,254.25,"PF Carmelo Anthony SF Paul George C Kelly Olynyk PG Tyler Johnson G Dennis Smith Jr. F P.J. Tucker UTIL Trevor Ariza SG James Harden",NA,"","","",NA
850,966723487,"Tenaciousakat1",0,254.25,"UTIL Raymond Felton PG Russell Westbrook PF Kelly Olynyk SF Josh Richardson C Nene Hilario SG James Harden F Montrezl Harrell G Jeremy Lamb",NA,"","","",NA
850,966757824,"massey0210 (1/4)",0,254.25,"C Steven Adams PF John Collins SF Harrison Barnes F Bam Adebayo G Eric Gordon UTIL Dwight Howard PG Kemba Walker SG Khris Middleton",NA,"","","",NA
850,966824211,"GingerRedMen",0,254.25,"F Carmelo Anthony UTIL Raymond Felton PF Luke Babbitt G Austin Rivers C Dwight Howard PG Kemba Walker SG Eric Bledsoe SF Giannis Antetokounmpo",NA,"","","",NA
850,966848614,"gfay63 (11/20)",0,254.25,"SG Marco Belinelli PF Kelly Olynyk G Tyler Johnson C Nene Hilario F P.J. Tucker PG James Harden UTIL John Henson SF Giannis Antetokounmpo",NA,"","","",NA
850,967029022,"Brucer",0,254.25,"F Paul George C Steven Adams SG Dennis Smith Jr. PF Maxi Kleber UTIL P.J. Tucker PG James Harden G Eric Bledsoe SF Jeremy Lamb",NA,"","","",NA
850,967070162,"superjjp2001",0,254.25,"PF Carmelo Anthony F Paul George UTIL Kelly Olynyk PG Dennis Smith Jr. G Trevor Ariza C DeAndre Jordan SG Eric Gordon SF Khris Middleton",NA,"","","",NA
857,966596198,"cbrewer78 (2/3)",0,254,"PG Isaiah Taylor PF P.J. Tucker F Trevor Ariza SG James Harden SF Jamil Wilson G Austin Rivers C John Henson UTIL Giannis Antetokounmpo",NA,"","","",NA
857,967059452,"qbasic7777 (16/20)",0,254,"PF Carmelo Anthony SF Kent Bazemore F P.J. Tucker C DeAndre Jordan UTIL Dwight Howard PG Kemba Walker SG Eric Bledsoe G Jeremy Lamb",NA,"","","",NA
859,966513324,"johnnyo199",0,253.75,"PF Carmelo Anthony F Harrison Barnes G Tyler Johnson SG Josh Richardson UTIL Maxi Kleber PG James Harden C Montrezl Harrell SF Khris Middleton",NA,"","","",NA
859,967043456,"msteiny99",0,253.75,"SF Carmelo Anthony F Josh Richardson PG Dennis Smith Jr. C Nene Hilario G Eric Gordon UTIL Khris Middleton SG Malcolm Brogdon PF Giannis Antetokounmpo",NA,"","","",NA
859,967087032,"zhahn7",0,253.75,"G Russell Westbrook SG Wayne Ellington PF Harrison Barnes PG Tyler Johnson SF Josh Richardson UTIL Dennis Smith Jr. C Dwight Howard F Michael Kidd-Gilchrist",NA,"","","",NA
862,966717475,"zoscak44",0,253.25,"PF Carmelo Anthony SF Paul George F Dion Waiters G Tyler Johnson SG Eric Gordon PG Austin Rivers C Dwight Howard UTIL Kemba Walker",NA,"","","",NA
862,966822260,"jcollard27 (2/2)",0,253.25,"UTIL Andre Roberson PF Dirk Nowitzki F Jordan Mickey PG James Harden SG Eric Gordon C John Henson G Jeremy Lamb SF Giannis Antetokounmpo",NA,"","","",NA
862,966848615,"gfay63 (12/20)",0,253.25,"SF Carmelo Anthony C Kelly Olynyk F Harrison Barnes PG Tyler Johnson PF Bam Adebayo G Trevor Ariza SG Eric Gordon UTIL Giannis Antetokounmpo",NA,"","","",NA
862,966848618,"gfay63 (15/20)",0,253.25,"SF Carmelo Anthony C Kelly Olynyk F Harrison Barnes PG Tyler Johnson PF Bam Adebayo G Trevor Ariza SG Eric Gordon UTIL Giannis Antetokounmpo",NA,"","","",NA
862,966918934,"salatso22",0,253.25,"SF Dion Waiters PF Jordan Mickey C Nene Hilario PG Lou Williams SG James Harden F Montrezl Harrell UTIL Eric Bledsoe G Khris Middleton",NA,"","","",NA
867,966642936,"ericg105",0,253,"UTIL Carmelo Anthony PF Kelly Olynyk PG Dennis Smith Jr. C Nene Hilario F Trevor Ariza SG James Harden G Eric Gordon SF Khris Middleton",NA,"","","",NA
868,966669382,"stoney884",0,252.75,"SF Carmelo Anthony PF Ersan Ilyasova UTIL Paul George F Kelly Olynyk PG Tyler Johnson C Dwight Howard G Eric Bledsoe SG Khris Middleton",NA,"","","",NA
868,966735669,"keonip11 (1/20)",0,252.75,"SG Marco Belinelli G Tyler Johnson UTIL Nene Hilario PF P.J. Tucker F Trevor Ariza PG James Harden C John Henson SF Giannis Antetokounmpo",NA,"","","",NA
868,966735670,"keonip11 (2/20)",0,252.75,"SG Marco Belinelli G Tyler Johnson UTIL Nene Hilario PF P.J. Tucker F Trevor Ariza PG James Harden C John Henson SF Giannis Antetokounmpo",NA,"","","",NA
868,966735671,"keonip11 (3/20)",0,252.75,"SG Marco Belinelli G Tyler Johnson UTIL Nene Hilario PF P.J. Tucker F Trevor Ariza PG James Harden C John Henson SF Giannis Antetokounmpo",NA,"","","",NA
868,966735672,"keonip11 (4/20)",0,252.75,"SG Marco Belinelli G Tyler Johnson UTIL Nene Hilario PF P.J. Tucker F Trevor Ariza PG James Harden C John Henson SF Giannis Antetokounmpo",NA,"","","",NA
868,966735673,"keonip11 (5/20)",0,252.75,"SG Marco Belinelli G Tyler Johnson UTIL Nene Hilario PF P.J. Tucker F Trevor Ariza PG James Harden C John Henson SF Giannis Antetokounmpo",NA,"","","",NA
868,966735674,"keonip11 (6/20)",0,252.75,"SG Marco Belinelli G Tyler Johnson UTIL Nene Hilario PF P.J. Tucker F Trevor Ariza PG James Harden C John Henson SF Giannis Antetokounmpo",NA,"","","",NA
868,966735675,"keonip11 (7/20)",0,252.75,"SG Marco Belinelli G Tyler Johnson UTIL Nene Hilario PF P.J. Tucker F Trevor Ariza PG James Harden C John Henson SF Giannis Antetokounmpo",NA,"","","",NA
868,966735676,"keonip11 (8/20)",0,252.75,"SG Marco Belinelli G Tyler Johnson UTIL Nene Hilario PF P.J. Tucker F Trevor Ariza PG James Harden C John Henson SF Giannis Antetokounmpo",NA,"","","",NA
868,966735677,"keonip11 (9/20)",0,252.75,"SG Marco Belinelli G Tyler Johnson UTIL Nene Hilario PF P.J. Tucker F Trevor Ariza PG James Harden C John Henson SF Giannis Antetokounmpo",NA,"","","",NA
868,966735678,"keonip11 (10/20)",0,252.75,"SG Marco Belinelli G Tyler Johnson UTIL Nene Hilario PF P.J. Tucker F Trevor Ariza PG James Harden C John Henson SF Giannis Antetokounmpo",NA,"","","",NA
868,966735679,"keonip11 (11/20)",0,252.75,"SG Marco Belinelli G Tyler Johnson UTIL Nene Hilario PF P.J. Tucker F Trevor Ariza PG James Harden C John Henson SF Giannis Antetokounmpo",NA,"","","",NA
868,966735680,"keonip11 (12/20)",0,252.75,"SG Marco Belinelli G Tyler Johnson UTIL Nene Hilario PF P.J. Tucker F Trevor Ariza PG James Harden C John Henson SF Giannis Antetokounmpo",NA,"","","",NA
868,966735681,"keonip11 (13/20)",0,252.75,"SG Marco Belinelli G Tyler Johnson UTIL Nene Hilario PF P.J. Tucker F Trevor Ariza PG James Harden C John Henson SF Giannis Antetokounmpo",NA,"","","",NA
868,966735682,"keonip11 (14/20)",0,252.75,"SG Marco Belinelli G Tyler Johnson UTIL Nene Hilario PF P.J. Tucker F Trevor Ariza PG James Harden C John Henson SF Giannis Antetokounmpo",NA,"","","",NA
868,966735683,"keonip11 (15/20)",0,252.75,"SG Marco Belinelli G Tyler Johnson UTIL Nene Hilario PF P.J. Tucker F Trevor Ariza PG James Harden C John Henson SF Giannis Antetokounmpo",NA,"","","",NA
868,966735684,"keonip11 (16/20)",0,252.75,"SG Marco Belinelli G Tyler Johnson UTIL Nene Hilario PF P.J. Tucker F Trevor Ariza PG James Harden C John Henson SF Giannis Antetokounmpo",NA,"","","",NA
868,966735685,"keonip11 (17/20)",0,252.75,"SG Marco Belinelli G Tyler Johnson UTIL Nene Hilario PF P.J. Tucker F Trevor Ariza PG James Harden C John Henson SF Giannis Antetokounmpo",NA,"","","",NA
868,966735686,"keonip11 (18/20)",0,252.75,"SG Marco Belinelli G Tyler Johnson UTIL Nene Hilario PF P.J. Tucker F Trevor Ariza PG James Harden C John Henson SF Giannis Antetokounmpo",NA,"","","",NA
868,966735687,"keonip11 (19/20)",0,252.75,"SG Marco Belinelli G Tyler Johnson UTIL Nene Hilario PF P.J. Tucker F Trevor Ariza PG James Harden C John Henson SF Giannis Antetokounmpo",NA,"","","",NA
868,966735688,"keonip11 (20/20)",0,252.75,"SG Marco Belinelli G Tyler Johnson UTIL Nene Hilario PF P.J. Tucker F Trevor Ariza PG James Harden C John Henson SF Giannis Antetokounmpo",NA,"","","",NA
889,967075263,"prado5432",0,252.5,"PF Carmelo Anthony F Patrick Patterson G Andre Roberson C Dirk Nowitzki SG Trevor Ariza PG James Harden SF Jeremy Lamb UTIL Giannis Antetokounmpo",NA,"","","",NA
890,966769365,"nkamal73",0,252.25,"PF Ersan Ilyasova UTIL Bam Adebayo SF P.J. Tucker F Trevor Ariza PG James Harden C Dwight Howard SG Khris Middleton G Malcolm Brogdon",NA,"","","",NA
890,967022279,"VallyD (8/8)",0,252.25,"SF Carmelo Anthony PF John Collins F Jordan Mickey C DeAndre Jordan G Eric Gordon UTIL Dwight Howard PG Kemba Walker SG Khris Middleton",NA,"","","",NA
892,966755945,"jjhs51",0,252,"SF Ersan Ilyasova PG Russell Westbrook F Kent Bazemore G Wesley Matthews PF Kelly Olynyk UTIL DeAndre Jordan SG Nicolas Batum C John Henson",NA,"","","",NA
892,966756625,"Cangamble",0,252,"G Marco Belinelli SG Kent Bazemore C Dirk Nowitzki UTIL Trevor Ariza PG James Harden F Jamil Wilson PF Montrezl Harrell SF Giannis Antetokounmpo",NA,"","","",NA
892,966931315,"mdedible55",0,252,"F Paul George SF Wesley Matthews G Dennis Smith Jr. PF Ryan Anderson PG James Harden SG Eric Gordon C Dwight Howard UTIL Marvin Williams",NA,"","","",NA
892,967015217,"jmalson",0,252,"F Harrison Barnes UTIL Nene Hilario PG James Harden SG Austin Rivers C John Henson G Matthew Dellavedova PF Frank Kaminsky SF Giannis Antetokounmpo",NA,"","","",NA
896,966604829,"mrcse13 (20/20)",0,251.75,"UTIL Steven Adams PF Jordan Mickey SG Lou Williams F Montrezl Harrell C Dwight Howard PG Kemba Walker G Eric Bledsoe SF Khris Middleton",NA,"","","",NA
896,966817431,"Turftoe21 (2/2)",0,251.75,"SG Dennis Smith Jr. C Nene Hilario F Ryan Anderson PG James Harden UTIL Eric Gordon SF Jamil Wilson G Malcolm Brogdon PF Giannis Antetokounmpo",NA,"","","",NA
896,966937590,"TwoHawks",0,251.75,"SG Marco Belinelli C Kelly Olynyk UTIL Dennis Smith Jr. PF Maxi Kleber SF P.J. Tucker G James Harden PG Malcolm Brogdon F Giannis Antetokounmpo",NA,"","","",NA
896,967076025,"Superjaded4",0,251.75,"F Paul George SG Wesley Matthews UTIL Harrison Barnes G Tyler Johnson PF P.J. Tucker PG Eric Bledsoe C Frank Kaminsky SF Giannis Antetokounmpo",NA,"","","",NA
896,967085234,"coachscottt (1/2)",0,251.75,"PG Russell Westbrook G Tyler Johnson PF Jordan Mickey C Nene Hilario F P.J. Tucker SG James Harden UTIL Eric Gordon SF Jamil Wilson",NA,"","","",NA
896,967085458,"coachscottt (2/2)",0,251.75,"PG Russell Westbrook G Tyler Johnson PF Jordan Mickey C Nene Hilario F P.J. Tucker SG James Harden UTIL Eric Gordon SF Jamil Wilson",NA,"","","",NA
902,966530420,"chubbymeatball",0,251.5,"UTIL Carmelo Anthony SG Andre Roberson C Kelly Olynyk PG James Harden F Marvin Williams SF Nicolas Batum PF Giannis Antetokounmpo G Malik Monk",NA,"","","",NA
902,966717477,"HurricaneRick",0,251.5,"C Steven Adams UTIL Tyler Johnson PF Jordan Mickey F Maxi Kleber G Trevor Ariza PG James Harden SG Eric Gordon SF Khris Middleton",NA,"","","",NA
902,966753191,"Cerellia",0,251.5,"G Russell Westbrook SF Kent Bazemore PF Dirk Nowitzki UTIL Wesley Matthews PG Dennis Smith Jr. SG Trevor Ariza C DeAndre Jordan F Jeremy Lamb",NA,"","","",NA
902,966839541,"tripdad2004",0,251.5,"G Dennis Smith Jr. UTIL Bam Adebayo PF Maxi Kleber C Nene Hilario PG James Harden SG Austin Rivers SF Jeremy Lamb F Giannis Antetokounmpo",NA,"","","",NA
906,966998265,"stevesax",0,251.25,"C John Collins SF Josh Richardson PG Dennis Smith Jr. F Jamil Wilson G Kemba Walker SG Khris Middleton UTIL Jeremy Lamb PF Giannis Antetokounmpo",NA,"","","",NA
907,966789215,"waroomwarrior (1/2)",0,251,"UTIL John Collins SF Trevor Ariza PG James Harden SG Eric Gordon F Montrezl Harrell C Dwight Howard G Kemba Walker PF Frank Kaminsky",NA,"","","",NA
907,966950340,"u0103687",0,251,"UTIL Marco Belinelli F Harrison Barnes G Yogi Ferrell C Nene Hilario PG James Harden PF Jamil Wilson SG Jeremy Lamb SF Giannis Antetokounmpo",NA,"","","",NA
909,966410522,"loopy22",0,250.75,"SF Ersan Ilyasova G Tyler Johnson C Nene Hilario PF Ryan Anderson PG James Harden UTIL Montrezl Harrell SG Nicolas Batum F Giannis Antetokounmpo",NA,"","","",NA
909,966643421,"FJFitz34 (4/4)",0,250.75,"UTIL Kelly Olynyk G Tyler Johnson F Jordan Mickey SF P.J. Tucker PG Lou Williams PF Ryan Anderson SG James Harden C Dwight Howard",NA,"","","",NA
909,966674412,"forrestkoba (4/20)",0,250.75,"SF Paul George C Kelly Olynyk PG Tyler Johnson SG Josh Richardson F P.J. Tucker UTIL Trevor Ariza G James Harden PF Montrezl Harrell",NA,"","","",NA
909,966801305,"waroomwarrior (2/2)",0,250.75,"UTIL Steven Adams SG Wesley Matthews SF Wayne Ellington F Josh Richardson PG James Harden G Eric Gordon PF Montrezl Harrell C Dwight Howard",NA,"","","",NA
909,967065285,"vosvegas",0,250.75,"PG Russell Westbrook SF Wesley Matthews C Nene Hilario UTIL James Harden G C.J. Williams F Jamil Wilson SG Khris Middleton PF Frank Kaminsky",NA,"","","",NA
914,966668391,"Mattynice77",0,250.5,"G Andre Roberson C John Collins PF Harrison Barnes F P.J. Tucker SG Lou Williams PG James Harden UTIL Dwight Howard SF Michael Kidd-Gilchrist",NA,"","","",NA
915,966474655,"mkritz",0,250.25,"PF Carmelo Anthony F Paul George UTIL Steven Adams SF Taurean Prince PG Dennis Smith Jr. SG James Harden C Tarik Black G Nicolas Batum",NA,"","","",NA
915,966604813,"mrcse13 (16/20)",0,250.25,"F Ersan Ilyasova G Tyler Johnson PF Bam Adebayo C Nene Hilario PG James Harden UTIL Montrezl Harrell SG Nicolas Batum SF Giannis Antetokounmpo",NA,"","","",NA
915,966635883,"Dean930",0,250.25,"PG Russell Westbrook SF Kent Bazemore G Dennis Smith Jr. C Nene Hilario UTIL P.J. Tucker PF Ryan Anderson SG James Harden F Montrezl Harrell",NA,"","","",NA
915,966822655,"BlueRob (13/18)",0,250.25,"SF Kent Bazemore F Kelly Olynyk G Dion Waiters PF P.J. Tucker SG Lou Williams C DeAndre Jordan UTIL Nicolas Batum PG Kemba Walker",NA,"","","",NA
915,966858994,"SkipMcCarthy",0,250.25,"G Raymond Felton PG Russell Westbrook F Luke Babbitt UTIL Andre Roberson PF Dwight Powell SG James Harden C Johnny O'Bryant III SF Giannis Antetokounmpo",NA,"","","",NA
915,966874304,"IA2016 (2/2)",0,250.25,"SF Carmelo Anthony UTIL Paul George F Kelly Olynyk C Nene Hilario SG Trevor Ariza PG Lou Williams G James Harden PF Montrezl Harrell",NA,"","","",NA
915,966886893,"fupadupa (1/5)",0,250.25,"F Dirk Nowitzki PF Kelly Olynyk PG Tyler Johnson SF Trevor Ariza SG James Harden G Eric Gordon UTIL Sam Dekker C Dwight Howard",NA,"","","",NA
915,966886910,"fupadupa (2/5)",0,250.25,"F Dirk Nowitzki PF Kelly Olynyk PG Tyler Johnson SF Trevor Ariza SG James Harden G Eric Gordon UTIL Sam Dekker C Dwight Howard",NA,"","","",NA
915,966886924,"fupadupa (3/5)",0,250.25,"F Dirk Nowitzki PF Kelly Olynyk PG Tyler Johnson SF Trevor Ariza SG James Harden G Eric Gordon UTIL Sam Dekker C Dwight Howard",NA,"","","",NA
915,966887429,"fupadupa (4/5)",0,250.25,"F Dirk Nowitzki PF Kelly Olynyk PG Tyler Johnson SF Trevor Ariza SG James Harden G Eric Gordon UTIL Sam Dekker C Dwight Howard",NA,"","","",NA
915,966889361,"fupadupa (5/5)",0,250.25,"F Dirk Nowitzki PF Kelly Olynyk PG Tyler Johnson SF Trevor Ariza SG James Harden G Eric Gordon UTIL Sam Dekker C Dwight Howard",NA,"","","",NA
926,966844577,"ghostcougar",0,250,"UTIL Kent Bazemore F Taurean Prince PF Harrison Barnes G Tyler Johnson SF Josh Richardson C Jordan Mickey SG Dennis Smith Jr. PG James Harden",NA,"","","",NA
926,966861944,"Dent_Face",0,250,"PF Carmelo Anthony C Dirk Nowitzki UTIL J.J. Barea SF Harrison Barnes F Maxi Kleber G Trevor Ariza PG James Harden SG Khris Middleton",NA,"","","",NA
926,966962050,"scjeez (17/20)",0,250,"F Carmelo Anthony PF Kelly Olynyk C Nene Hilario SF P.J. Tucker G James Harden SG Eric Gordon PG Austin Rivers UTIL Dwight Howard",NA,"","","",NA
929,966762890,"AtexasM",0,249.75,"G Russell Westbrook C Kelly Olynyk F Jordan Mickey SG Dennis Smith Jr. SF P.J. Tucker PG James Harden PF Montrezl Harrell UTIL Malcolm Brogdon",NA,"","","",NA
929,966773056,"blazeman8 (5/20)",0,249.75,"UTIL Jordan Mickey C Nene Hilario F P.J. Tucker G James Harden SG Eric Gordon PG Austin Rivers PF Montrezl Harrell SF Giannis Antetokounmpo",NA,"","","",NA
929,967059320,"qbasic7777 (14/20)",0,249.75,"F Paul George UTIL Kelly Olynyk SF Harrison Barnes PF Maxi Kleber PG James Harden SG Austin Rivers G Nicolas Batum C John Henson",NA,"","","",NA
932,966752946,"nchuraman",0,249.5,"SF Paul George C John Collins PF Kelly Olynyk F Harrison Barnes PG Dennis Smith Jr. UTIL Nene Hilario SG James Harden G Eric Gordon",NA,"","","",NA
932,966815791,"BlueRob (2/18)",0,249.5,"SF Wesley Matthews PF Kelly Olynyk UTIL Dion Waiters SG Josh Richardson PG James Harden C DeAndre Jordan F Montrezl Harrell G Malcolm Brogdon",NA,"","","",NA
934,967059522,"qbasic7777 (19/20)",0,249.25,"PG Russell Westbrook SF Kent Bazemore F Taurean Prince UTIL John Collins PF Kelly Olynyk G Dion Waiters SG Austin Rivers C John Henson",NA,"","","",NA
935,966558026,"volsfan816",0,249,"UTIL Andre Roberson F John Collins C Kelly Olynyk G Dennis Smith Jr. SG James Harden PF Montrezl Harrell PG Malcolm Brogdon SF Giannis Antetokounmpo",NA,"","","",NA
935,966968334,"WingoinTexas (2/2)",0,249,"C Dirk Nowitzki PG J.J. Barea PF Harrison Barnes G Eric Gordon SG Khris Middleton F Jeremy Lamb UTIL Michael Kidd-Gilchrist SF Giannis Antetokounmpo",NA,"","","",NA
937,967009511,"chefcurry68 (19/20)",0,248.75,"SG Marco Belinelli G Wayne Ellington PF Jordan Mickey F Bam Adebayo UTIL Nene Hilario PG James Harden C Dwight Howard SF Giannis Antetokounmpo",NA,"","","",NA
938,966598300,"jgoody (2/3)",0,248.5,"F Carmelo Anthony UTIL Paul George C Nene Hilario PG James Harden SG Eric Gordon PF Montrezl Harrell G Khris Middleton SF Jeremy Lamb",NA,"","","",NA
