"Rank","EntryId","EntryName","TimeRemaining","Points","Lineup","X","Player","Roster.Position","X.Drafted","FPTS"
531,966832545,"EasyDaysPay (6/6)",0,273.75,"PF Carmelo Anthony PG Russell Westbrook G Marco Belinelli SG Kent Bazemore C Miles Plumlee F Paul George SF Taurean Prince UTIL Kemba Walker",NA,"","","",NA
531,966901609,"PowerTron (17/20)",0,273.75,"PG Russell Westbrook UTIL John Collins C Nene Hilario SF P.J. Tucker PF Ryan Anderson SG James Harden G Eric Gordon F Montrezl Harrell",NA,"","","",NA
531,966965874,"rabbit53",0,273.75,"PF Carmelo Anthony C Kelly Olynyk G Dennis Smith Jr. PG James Harden SG Eric Gordon F Khris Middleton SF Jeremy Lamb UTIL Frank Kaminsky",NA,"","","",NA
537,966416752,"docholaday",0,273.5,"PF Carmelo Anthony G Russell Westbrook SF P.J. Tucker F Trevor Ariza C DeAndre Jordan SG Eric Gordon UTIL John Henson PG Malcolm Brogdon",NA,"","","",NA
537,966572558,"geezy15",0,273.5,"PF Carmelo Anthony SF Paul George C Kelly Olynyk F P.J. Tucker SG Trevor Ariza UTIL Ryan Anderson PG James Harden G Eric Gordon",NA,"","","",NA
537,966575827,"TDKid63 (1/20)",0,273.5,"PF Carmelo Anthony SF Paul George C Kelly Olynyk F P.J. Tucker SG Trevor Ariza UTIL Ryan Anderson PG James Harden G Eric Gordon",NA,"","","",NA
537,966575917,"TDKid63 (5/20)",0,273.5,"F Paul George UTIL Kelly Olynyk PG Tyler Johnson PF P.J. Tucker SF Trevor Ariza C Ryan Anderson G James Harden SG Eric Gordon",NA,"","","",NA
537,966585977,"TDKid63 (19/20)",0,273.5,"F Paul George UTIL Kelly Olynyk PG Tyler Johnson PF P.J. Tucker SF Trevor Ariza C Ryan Anderson G James Harden SG Eric Gordon",NA,"","","",NA
537,966586010,"TDKid63 (20/20)",0,273.5,"PF Carmelo Anthony SF Paul George C Kelly Olynyk F P.J. Tucker SG Trevor Ariza UTIL Ryan Anderson PG James Harden G Eric Gordon",NA,"","","",NA
537,966756743,"zachdaddy (1/10)",0,273.5,"F Paul George UTIL Kelly Olynyk PG Tyler Johnson PF P.J. Tucker SF Trevor Ariza C Ryan Anderson G James Harden SG Eric Gordon",NA,"","","",NA
537,966764503,"zachdaddy (10/10)",0,273.5,"PF Carmelo Anthony SF Paul George C Kelly Olynyk F P.J. Tucker SG Trevor Ariza UTIL Ryan Anderson PG James Harden G Eric Gordon",NA,"","","",NA
537,966962035,"scjeez (2/20)",0,273.5,"SF Paul George C Kelly Olynyk UTIL Tyler Johnson PF P.J. Tucker G Trevor Ariza F Ryan Anderson PG James Harden SG Eric Gordon",NA,"","","",NA
537,966996959,"csyco",0,273.5,"PF Carmelo Anthony SF Paul George C Steven Adams PG Dennis Smith Jr. F Trevor Ariza UTIL DeAndre Jordan SG Eric Gordon G Kemba Walker",NA,"","","",NA
537,967061955,"njsteve (3/3)",0,273.5,"SF Carmelo Anthony UTIL Paul George PF Kelly Olynyk F P.J. Tucker G Trevor Ariza C Ryan Anderson PG James Harden SG Eric Gordon",NA,"","","",NA
548,966693393,"Jreck82 (2/3)",0,273.25,"SF Ersan Ilyasova F Jordan Mickey C Nene Hilario PF Ryan Anderson PG James Harden SG Austin Rivers G Jeremy Lamb UTIL Giannis Antetokounmpo",NA,"","","",NA
548,966703672,"fieldrunners",0,273.25,"SF Carmelo Anthony UTIL Kent Bazemore C Steven Adams PF John Collins F Wesley Matthews G Dennis Smith Jr. PG James Harden SG Eric Gordon",NA,"","","",NA
550,966556027,"JJWATTSUP",0,273,"C Steven Adams SF Taurean Prince G Josh Richardson F P.J. Tucker PG Austin Rivers UTIL Montrezl Harrell SG Eric Bledsoe PF Giannis Antetokounmpo",NA,"","","",NA
550,966661362,"Stevmac",0,273,"F Kelly Olynyk PF Harrison Barnes SF Josh Richardson UTIL Jordan Mickey C DeAndre Jordan SG Eric Gordon PG Kemba Walker G Khris Middleton",NA,"","","",NA
550,966725223,"mountaineer45",0,273,"PF John Collins SG Josh Richardson C Nene Hilario F Trevor Ariza PG James Harden G Eric Gordon SF Khris Middleton UTIL Jeremy Lamb",NA,"","","",NA
550,966756718,"rw65",0,273,"PF Carmelo Anthony G Andre Roberson C Steven Adams SF Taurean Prince UTIL Trevor Ariza PG James Harden F Marvin Williams SG Khris Middleton",NA,"","","",NA
550,966770594,"RiverboatGambler34",0,273,"UTIL Marco Belinelli G Kent Bazemore PF Kelly Olynyk SF Josh Richardson SG James Harden PG Austin Rivers F Montrezl Harrell C Dwight Howard",NA,"","","",NA
550,966817337,"Turftoe21 (1/2)",0,273,"SF Ersan Ilyasova UTIL Yogi Ferrell SG Dennis Smith Jr. C Nene Hilario F Ryan Anderson PG James Harden G Malcolm Brogdon PF Giannis Antetokounmpo",NA,"","","",NA
550,966962034,"scjeez (1/20)",0,273,"F Carmelo Anthony SF Paul George C Kelly Olynyk UTIL Bam Adebayo PF P.J. Tucker G Trevor Ariza PG James Harden SG Eric Gordon",NA,"","","",NA
550,966962049,"scjeez (16/20)",0,273,"PF Carmelo Anthony F Paul George C Kelly Olynyk UTIL Bam Adebayo SF P.J. Tucker SG Trevor Ariza PG James Harden G Eric Gordon",NA,"","","",NA
550,967009507,"chefcurry68 (15/20)",0,273,"F Carmelo Anthony SF Paul George C Kelly Olynyk PF Bam Adebayo UTIL P.J. Tucker G Trevor Ariza PG James Harden SG Eric Gordon",NA,"","","",NA
550,967101917,"fumbawear (2/2)",0,273,"UTIL Carmelo Anthony F Paul George C Steven Adams SF Taurean Prince PF Kelly Olynyk G Eric Gordon PG Austin Rivers SG Khris Middleton",NA,"","","",NA
560,966707764,"clevegrl",0,272.5,"SF Carmelo Anthony C Steven Adams F Wesley Matthews PF Kelly Olynyk SG Dennis Smith Jr. PG James Harden UTIL Marvin Williams G Khris Middleton",NA,"","","",NA
560,966785493,"jjandy6785",0,272.5,"PF Dirk Nowitzki SG Dennis Smith Jr. C Bam Adebayo PG James Harden G Eric Gordon F Jamil Wilson UTIL Frank Kaminsky SF Giannis Antetokounmpo",NA,"","","",NA
560,966856940,"Footeword (3/3)",0,272.5,"PF Carmelo Anthony PG Russell Westbrook SF Paul George F Andre Roberson C Steven Adams G Josh Richardson UTIL Nene Hilario SG Eric Gordon",NA,"","","",NA
560,966962047,"scjeez (14/20)",0,272.5,"SF Carmelo Anthony F Paul George PG Tyler Johnson C Nene Hilario PF P.J. Tucker SG Trevor Ariza G James Harden UTIL Eric Bledsoe",NA,"","","",NA
560,967062301,"castro2033",0,272.5,"SF Carmelo Anthony C Steven Adams F Taurean Prince PF Kelly Olynyk UTIL Trevor Ariza PG Kemba Walker G Eric Bledsoe SG Khris Middleton",NA,"","","",NA
565,966588399,"jgoody (1/3)",0,272.25,"SF Carmelo Anthony G Tyler Johnson C Nene Hilario PF Ryan Anderson UTIL James Harden SG C.J. Williams PG Malcolm Brogdon F Giannis Antetokounmpo",NA,"","","",NA
565,966643531,"WCswami",0,272.25,"SF Carmelo Anthony G Andre Roberson UTIL John Collins PF Kelly Olynyk PG James Harden C DeAndre Jordan F Montrezl Harrell SG Khris Middleton",NA,"","","",NA
565,966678580,"davematic83",0,272.25,"G Kent Bazemore SF Taurean Prince PF Kelly Olynyk SG Josh Richardson C Bam Adebayo PG Eric Bledsoe F Frank Kaminsky UTIL Giannis Antetokounmpo",NA,"","","",NA
565,966742203,"loso180",0,272.25,"C Steven Adams UTIL Jerami Grant F Wesley Matthews SF Harrison Barnes G Tyler Johnson PG Austin Rivers SG Eric Bledsoe PF Giannis Antetokounmpo",NA,"","","",NA
569,966552059,"jamabel",0,272,"C Steven Adams F Kelly Olynyk SF Harrison Barnes PF Jordan Mickey G Lou Williams UTIL Eric Gordon PG Kemba Walker SG Khris Middleton",NA,"","","",NA
569,966593681,"55Boog",0,272,"UTIL Andre Roberson PF Kelly Olynyk SF Josh Richardson F Trevor Ariza PG James Harden SG Eric Gordon C John Henson G Khris Middleton",NA,"","","",NA
569,966644714,"rleynesjr",0,272,"F Kent Bazemore C Kelly Olynyk PF Harrison Barnes UTIL P.J. Tucker PG Lou Williams SG Eric Gordon G Kemba Walker SF Khris Middleton",NA,"","","",NA
569,966659366,"ColinSmokesFatPole (2/2)",0,272,"PF Carmelo Anthony UTIL Kent Bazemore SF Harrison Barnes SG Trevor Ariza C DeAndre Jordan PG Austin Rivers G Nicolas Batum F Khris Middleton",NA,"","","",NA
569,966901593,"PowerTron (1/20)",0,272,"SF Carmelo Anthony PG Russell Westbrook G Marco Belinelli PF Kelly Olynyk UTIL Jordan Mickey C Nene Hilario F P.J. Tucker SG James Harden",NA,"","","",NA
569,966936693,"hgwynn94",0,272,"F Jerami Grant SF Josh Richardson PG Dennis Smith Jr. SG James Harden UTIL Marvin Williams G Jeremy Lamb C Frank Kaminsky PF Giannis Antetokounmpo",NA,"","","",NA
569,967052883,"slingshotmaster",0,272,"F Carmelo Anthony SF Paul George PF Kelly Olynyk UTIL Jordan Mickey C Nene Hilario PG James Harden SG Eric Gordon G Eric Bledsoe",NA,"","","",NA
569,967088903,"lessardndt",0,272,"SF Paul George PF John Collins C Kelly Olynyk PG Tyler Johnson G Josh Richardson SG Trevor Ariza UTIL DeAndre Jordan F Khris Middleton",NA,"","","",NA
577,966829575,"luzraven",0,271.75,"G Marco Belinelli UTIL John Collins SG J.J. Barea F Kelly Olynyk C Nene Hilario PG James Harden PF Frank Kaminsky SF Giannis Antetokounmpo",NA,"","","",NA
577,966868522,"Italia031 (4/4)",0,271.75,"F Kent Bazemore PF Harrison Barnes SG Tyler Johnson SF Josh Richardson PG Dennis Smith Jr. C DeAndre Jordan G Eric Gordon UTIL Khris Middleton",NA,"","","",NA
577,967025937,"uxyspartan11",0,271.75,"UTIL Steven Adams SF Wayne Ellington C Kelly Olynyk G Dennis Smith Jr. SG Eric Gordon PG Eric Bledsoe F Jeremy Lamb PF Giannis Antetokounmpo",NA,"","","",NA
580,966524672,"HisExcellency",0,271.5,"F Ersan Ilyasova C Steven Adams SG J.J. Barea PF Jordan Mickey PG James Harden G Eric Gordon SF Khris Middleton UTIL Jeremy Lamb",NA,"","","",NA
580,966724236,"Jimmyiii33 (1/2)",0,271.5,"PF Carmelo Anthony C Steven Adams F Taurean Prince UTIL Wesley Matthews SF Trevor Ariza PG James Harden G Austin Rivers SG Jeremy Lamb",NA,"","","",NA
582,966866898,"mjinhis20s",0,271.25,"PG Russell Westbrook G Malcolm Delaney C Steven Adams F Jordan Mickey SG James Harden UTIL Eric Gordon SF Jamil Wilson PF Montrezl Harrell",NA,"","","",NA
582,966907598,"72Fridge85",0,271.25,"PF Carmelo Anthony UTIL Ersan Ilyasova SF Paul George C Kelly Olynyk G Dennis Smith Jr. PG James Harden SG Eric Gordon F Jeremy Lamb",NA,"","","",NA
584,966777737,"camskitchen",0,271,"SF Carmelo Anthony UTIL Dennis Smith Jr. PF P.J. Tucker F Trevor Ariza PG James Harden C DeAndre Jordan G Eric Bledsoe SG Tony Snell",NA,"","","",NA
584,966848609,"gfay63 (6/20)",0,271,"PF Carmelo Anthony G Marco Belinelli SF Paul George C Nene Hilario F Trevor Ariza PG Lou Williams SG Eric Gordon UTIL Giannis Antetokounmpo",NA,"","","",NA
584,966901603,"PowerTron (11/20)",0,271,"PG Russell Westbrook G Marco Belinelli UTIL John Collins PF Kelly Olynyk C Nene Hilario SF Trevor Ariza SG James Harden F Montrezl Harrell",NA,"","","",NA
587,966680904,"legatim23",0,270.75,"PF Ersan Ilyasova UTIL Álex Abrines SG J.J. Barea F Trevor Ariza C DeAndre Jordan PG Austin Rivers G Kemba Walker SF Giannis Antetokounmpo",NA,"","","",NA
587,966708540,"snootst44",0,270.75,"F Carmelo Anthony UTIL Jerami Grant PF Kelly Olynyk G Tyler Johnson C Nene Hilario SG Lou Williams PG James Harden SF Khris Middleton",NA,"","","",NA
587,966815999,"BlueRob (6/18)",0,270.75,"SG Kent Bazemore C Steven Adams PF Dirk Nowitzki F Dion Waiters SF Josh Richardson PG Lou Williams UTIL DeAndre Jordan G Nicolas Batum",NA,"","","",NA
587,966877719,"weatherman1333 (2/2)",0,270.75,"G Tyler Johnson SF Josh Richardson UTIL Nene Hilario PG James Harden C DeAndre Jordan PF Jamil Wilson SG Khris Middleton F Michael Kidd-Gilchrist",NA,"","","",NA
591,966504258,"MathuX",0,270.5,"SF Carmelo Anthony PF John Collins C Dirk Nowitzki SG Dion Waiters F Harrison Barnes G Tyler Johnson UTIL James Harden PG Malcolm Brogdon",NA,"","","",NA
591,966795243,"zepman57",0,270.5,"PG Russell Westbrook C Kelly Olynyk F Dwight Powell PF Harrison Barnes SF Trevor Ariza UTIL Austin Rivers G Khris Middleton SG Jeremy Lamb",NA,"","","",NA
591,966967684,"TylerMudd",0,270.5,"G Tyler Johnson F Josh Richardson C Nene Hilario PF P.J. Tucker SF Trevor Ariza PG James Harden SG Eric Gordon UTIL Khris Middleton",NA,"","","",NA
594,966816061,"BlueRob (9/18)",0,270.25,"PF Kelly Olynyk SG Josh Richardson SF P.J. Tucker PG Lou Williams F Ryan Anderson C DeAndre Jordan UTIL Dwight Howard G Kemba Walker",NA,"","","",NA
594,966821059,"erick545",0,270.25,"UTIL Marco Belinelli SG Kent Bazemore PF John Collins PG Dennis Smith Jr. C Nene Hilario G James Harden F Frank Kaminsky SF Giannis Antetokounmpo",NA,"","","",NA
594,966861708,"Dandad",0,270.25,"G Marco Belinelli UTIL Paul George SG Andre Roberson C Ryan Anderson PG James Harden PF Montrezl Harrell F Jeremy Lamb SF Giannis Antetokounmpo",NA,"","","",NA
597,966590655,"Nyack87 (1/5)",0,270,"UTIL Carmelo Anthony G Russell Westbrook PG Tyler Johnson C Nene Hilario SF P.J. Tucker F Ryan Anderson SG James Harden PF Montrezl Harrell",NA,"","","",NA
597,966590759,"Nyack87 (2/5)",0,270,"UTIL Carmelo Anthony G Russell Westbrook PG Tyler Johnson C Nene Hilario SF P.J. Tucker F Ryan Anderson SG James Harden PF Montrezl Harrell",NA,"","","",NA
597,966591490,"Nyack87 (3/5)",0,270,"UTIL Carmelo Anthony G Russell Westbrook PG Tyler Johnson C Nene Hilario SF P.J. Tucker F Ryan Anderson SG James Harden PF Montrezl Harrell",NA,"","","",NA
597,966627267,"kaferjoe",0,270,"G Russell Westbrook PG J.J. Barea F Wayne Ellington C Kelly Olynyk PF Harrison Barnes SG Eric Gordon UTIL John Henson SF Khris Middleton",NA,"","","",NA
597,966778301,"Nyack87 (4/5)",0,270,"UTIL Carmelo Anthony G Russell Westbrook PG Tyler Johnson C Nene Hilario SF P.J. Tucker F Ryan Anderson SG James Harden PF Montrezl Harrell",NA,"","","",NA
597,966778378,"Nyack87 (5/5)",0,270,"UTIL Carmelo Anthony G Russell Westbrook PG Tyler Johnson C Nene Hilario SF P.J. Tucker F Ryan Anderson SG James Harden PF Montrezl Harrell",NA,"","","",NA
597,966819955,"seanyman84 (2/2)",0,270,"PF Kelly Olynyk SF Dion Waiters G Tyler Johnson F Bam Adebayo C Nene Hilario SG Lou Williams PG James Harden UTIL Eric Gordon",NA,"","","",NA
597,966857923,"tbanaheimfan",0,270,"PF Kelly Olynyk SG Tyler Johnson SF Josh Richardson F Jordan Mickey G Dennis Smith Jr. PG James Harden C DeAndre Jordan UTIL Jeremy Lamb",NA,"","","",NA
597,966900210,"freedom2dfs (2/2)",0,270,"PG Russell Westbrook UTIL Taurean Prince PF John Collins G Tyler Johnson SF Josh Richardson F Trevor Ariza SG Eric Gordon C John Henson",NA,"","","",NA
597,966962041,"scjeez (8/20)",0,270,"SF Carmelo Anthony PG Russell Westbrook G Tyler Johnson C Nene Hilario F P.J. Tucker PF Ryan Anderson SG James Harden UTIL Montrezl Harrell",NA,"","","",NA
607,966570321,"perilous (14/20)",0,269.75,"PG Russell Westbrook SF Paul George G Wayne Ellington F Bam Adebayo UTIL Nene Hilario SG James Harden PF Jamil Wilson C John Henson",NA,"","","",NA
607,966773068,"blazeman8 (7/20)",0,269.75,"SG Marco Belinelli SF Paul George C Kelly Olynyk PF Harrison Barnes UTIL Tyler Johnson G Dennis Smith Jr. F Trevor Ariza PG James Harden",NA,"","","",NA
607,966815976,"BlueRob (5/18)",0,269.75,"F Paul George PF John Collins UTIL Kelly Olynyk SF Harrison Barnes PG Lou Williams G Kemba Walker C John Henson SG Khris Middleton",NA,"","","",NA
607,966835020,"rbsistrunk",0,269.75,"PF Jerami Grant G Wesley Matthews F Jordan Mickey SF Trevor Ariza UTIL Lou Williams PG James Harden C DeAndre Jordan SG Eric Gordon",NA,"","","",NA
607,966873440,"dwc1980 (2/2)",0,269.75,"UTIL Ersan Ilyasova SG Wesley Matthews PF Kelly Olynyk G Tyler Johnson SF Trevor Ariza PG James Harden C DeAndre Jordan F Michael Kidd-Gilchrist",NA,"","","",NA
607,966916709,"phildaprophet",0,269.75,"UTIL Russell Westbrook C Steven Adams F John Collins PG J.J. Barea G Tyler Johnson PF P.J. Tucker SF Khris Middleton SG Jeremy Lamb",NA,"","","",NA
607,967026054,"Mburger15",0,269.75,"SF Ersan Ilyasova G Tyler Johnson UTIL Maxi Kleber C Nene Hilario SG James Harden PG Austin Rivers PF Frank Kaminsky F Giannis Antetokounmpo",NA,"","","",NA
614,966763525,"twotone4488",0,269.5,"SF Carmelo Anthony PF Kelly Olynyk C Bam Adebayo PG James Harden G Jawun Evans UTIL Dwight Howard SG Eric Bledsoe F Jeremy Lamb",NA,"","","",NA
614,966856138,"Footeword (2/3)",0,269.5,"PF Carmelo Anthony SF Paul George C John Collins SG Tyler Johnson UTIL Maxi Kleber G Eric Gordon PG Austin Rivers F Giannis Antetokounmpo",NA,"","","",NA
616,966585970,"reedsa10",0,269.25,"PF Ersan Ilyasova F Taurean Prince G Wayne Ellington SG Tyler Johnson PG James Harden UTIL Montrezl Harrell C Frank Kaminsky SF Giannis Antetokounmpo",NA,"","","",NA
616,966674420,"forrestkoba (12/20)",0,269.25,"F Paul George C Kelly Olynyk PG Tyler Johnson SG Josh Richardson PF P.J. Tucker UTIL Trevor Ariza G James Harden SF Michael Kidd-Gilchrist",NA,"","","",NA
616,966801963,"Brody247",0,269.25,"G James Harden PF Sam Dekker UTIL Marvin Williams SG Nicolas Batum C John Henson F Jeremy Lamb PG Malcolm Brogdon SF Giannis Antetokounmpo",NA,"","","",NA
619,966626438,"cartwe",0,269,"C Steven Adams F John Collins UTIL J.J. Barea PF Kelly Olynyk SG Trevor Ariza PG James Harden G Eric Gordon SF Jeremy Lamb",NA,"","","",NA
619,966829753,"yungjcr15 (2/2)",0,269,"SG Kent Bazemore SF Paul George C Steven Adams UTIL John Collins PF Kelly Olynyk F Harrison Barnes PG Austin Rivers G Khris Middleton",NA,"","","",NA
621,966675338,"edz2015 (2/8)",0,268.75,"F Ersan Ilyasova SF Jerami Grant C Kelly Olynyk PF Maxi Kleber UTIL Lou Williams PG James Harden G Eric Gordon SG Khris Middleton",NA,"","","",NA
621,966839429,"robema19",0,268.75,"C Kelly Olynyk SG Tyler Johnson PG Yogi Ferrell F Maxi Kleber PF P.J. Tucker G James Harden UTIL Kemba Walker SF Khris Middleton",NA,"","","",NA
623,966604795,"mrcse13 (10/20)",0,268.5,"PF Carmelo Anthony SG Kent Bazemore C Kelly Olynyk F P.J. Tucker SF Trevor Ariza UTIL Ryan Anderson PG James Harden G Eric Gordon",NA,"","","",NA
623,966724393,"rip200",0,268.5,"UTIL Russell Westbrook SF Andre Roberson F John Collins SG Dennis Smith Jr. C Ryan Anderson G Jeremy Lamb PG Malcolm Brogdon PF Giannis Antetokounmpo",NA,"","","",NA
623,966772967,"aceurbanos",0,268.5,"PG Tyler Johnson C Nene Hilario SG James Harden UTIL Eric Gordon G Austin Rivers F Montrezl Harrell PF Johnny O'Bryant III SF Giannis Antetokounmpo",NA,"","","",NA
623,966916434,"CeriouslovesBonda",0,268.5,"SF Taurean Prince PF John Collins C Dirk Nowitzki F Marvin Williams PG Kemba Walker SG Khris Middleton G Jeremy Lamb UTIL Giannis Antetokounmpo",NA,"","","",NA
627,966695751,"jtmathena",0,268.25,"SF Ersan Ilyasova PF John Collins G James Harden C Dwight Howard F Nicolas Batum UTIL John Henson SG Eric Bledsoe PG Malcolm Brogdon",NA,"","","",NA
627,966766021,"massey0210 (3/4)",0,268.25,"F Dirk Nowitzki SG Wesley Matthews PF Bam Adebayo C Ryan Anderson PG James Harden UTIL John Henson G Jeremy Lamb SF Giannis Antetokounmpo",NA,"","","",NA
629,966535146,"mpm1279",0,268,"C Steven Adams UTIL J.J. Barea SF Wesley Matthews PF Kelly Olynyk G Tyler Johnson SG Josh Richardson PG James Harden F Jeremy Lamb",NA,"","","",NA
629,966570313,"perilous (6/20)",0,268,"PF Carmelo Anthony PG Russell Westbrook C Kelly Olynyk UTIL Dennis Smith Jr. SF P.J. Tucker F Trevor Ariza SG Eric Gordon G Kemba Walker",NA,"","","",NA
629,966766791,"clevelandforlife2017 (1/5)",0,268,"SF Ersan Ilyasova UTIL Steven Adams G Wesley Matthews PF Harrison Barnes F Trevor Ariza PG Lou Williams C DeAndre Jordan SG Khris Middleton",NA,"","","",NA
629,966845042,"hlrubino (2/2)",0,268,"F Andre Roberson UTIL Álex Abrines PF Jordan Mickey PG Lou Williams C DeAndre Jordan SG Austin Rivers G Khris Middleton SF Giannis Antetokounmpo",NA,"","","",NA
629,966954832,"KingTeabaggerX (2/2)",0,268,"G Kent Bazemore SF Jerami Grant PF John Collins F Harrison Barnes UTIL James Harden C DeAndre Jordan SG Jeremy Lamb PG Malcolm Brogdon",NA,"","","",NA
629,967029623,"jackedup21",0,268,"PF Carmelo Anthony SF Paul George UTIL John Collins F Harrison Barnes SG Eric Gordon G Austin Rivers C Dwight Howard PG Kemba Walker",NA,"","","",NA
635,966424608,"ethollis (1/2)",0,267.75,"F Carmelo Anthony SF Wesley Matthews UTIL Harrison Barnes G Dennis Smith Jr. PF Ryan Anderson PG James Harden C DeAndre Jordan SG Jeremy Lamb",NA,"","","",NA
635,966591028,"Little24",0,267.75,"SF Carmelo Anthony PG Russell Westbrook G Wayne Ellington PF Kelly Olynyk C Jordan Mickey UTIL P.J. Tucker SG James Harden F Montrezl Harrell",NA,"","","",NA
635,966674425,"forrestkoba (17/20)",0,267.75,"UTIL Carmelo Anthony SF Paul George C John Collins PG Dennis Smith Jr. PF P.J. Tucker F Trevor Ariza G James Harden SG Eric Gordon",NA,"","","",NA
635,966733500,"jrodjr918 (1/2)",0,267.75,"F Kent Bazemore SF Paul George PF Kelly Olynyk G Josh Richardson PG Yogi Ferrell C DeAndre Jordan SG Khris Middleton UTIL Jeremy Lamb",NA,"","","",NA
635,966747320,"jrodjr918 (2/2)",0,267.75,"F Kent Bazemore SF Paul George PF Kelly Olynyk G Josh Richardson PG Yogi Ferrell C DeAndre Jordan SG Khris Middleton UTIL Jeremy Lamb",NA,"","","",NA
635,966978562,"Greekpoker",0,267.75,"PF Kelly Olynyk SF Harrison Barnes PG Tyler Johnson F Josh Richardson SG Eric Gordon G Austin Rivers C Montrezl Harrell UTIL Giannis Antetokounmpo",NA,"","","",NA
635,967079598,"alexpny (2/3)",0,267.75,"UTIL John Collins SF Wayne Ellington F Kelly Olynyk G Josh Richardson PF P.J. Tucker PG James Harden SG Eric Gordon C Dwight Howard",NA,"","","",NA
642,966858650,"blangton69 (1/3)",0,267.5,"SF Kent Bazemore UTIL Steven Adams PF John Collins G Yogi Ferrell F Jordan Mickey PG James Harden C John Henson SG Khris Middleton",NA,"","","",NA
643,967100111,"greg817",0,267.25,"PG Russell Westbrook PF John Collins G Wayne Ellington C Kelly Olynyk SF Harrison Barnes SG Josh Richardson F Maxi Kleber UTIL Khris Middleton",NA,"","","",NA
644,966736821,"smurphy1",0,267,"SF Paul George UTIL Wayne Ellington PF Kelly Olynyk F Jordan Mickey C Nene Hilario PG James Harden G Kemba Walker SG Khris Middleton",NA,"","","",NA
644,967022274,"VallyD (3/8)",0,267,"F Carmelo Anthony PF John Collins SG Tyler Johnson UTIL Trevor Ariza C Dwight Howard PG Kemba Walker G Eric Bledsoe SF Khris Middleton",NA,"","","",NA
646,966582538,"123...Infinity (15/20)",0,266.75,"PF Carmelo Anthony F Paul George G Dennis Schroder C Nene Hilario SG James Harden SF Marvin Williams UTIL Eric Bledsoe PG Malcolm Brogdon",NA,"","","",NA
646,966866026,"kerstetter425",0,266.75,"UTIL Carmelo Anthony F Paul George C Steven Adams PF Kelly Olynyk G Dennis Smith Jr. SG Eric Gordon PG Kemba Walker SF Khris Middleton",NA,"","","",NA
646,966963817,"bmoney53",0,266.75,"PG Tyler Johnson PF Jordan Mickey C Ryan Anderson SG James Harden G Eric Gordon F Montrezl Harrell UTIL Frank Kaminsky SF Giannis Antetokounmpo",NA,"","","",NA
646,967059206,"qbasic7777 (12/20)",0,266.75,"G Russell Westbrook SG Tyler Johnson SF P.J. Tucker PG Austin Rivers C Montrezl Harrell UTIL John Henson PF Frank Kaminsky F Giannis Antetokounmpo",NA,"","","",NA
650,966604796,"mrcse13 (11/20)",0,266.5,"SF Ersan Ilyasova G Russell Westbrook SG Kent Bazemore C Jordan Mickey UTIL Nene Hilario PF P.J. Tucker F Ryan Anderson PG James Harden",NA,"","","",NA
650,966628673,"cecilmilton",0,266.5,"UTIL Carmelo Anthony F John Collins G J.J. Barea PF Kelly Olynyk PG Lou Williams SG Eric Gordon C John Henson SF Giannis Antetokounmpo",NA,"","","",NA
650,966779015,"Gusash0726",0,266.5,"PG Dennis Smith Jr. SG James Harden G Eric Gordon UTIL Marvin Williams SF Jeremy Lamb C Frank Kaminsky PF Giannis Antetokounmpo F Thon Maker",NA,"","","",NA
650,967046924,"tckrush (3/3)",0,266.5,"PG Russell Westbrook UTIL Yogi Ferrell G Dennis Smith Jr. C Nene Hilario F P.J. Tucker SF Trevor Ariza SG James Harden PF Frank Kaminsky",NA,"","","",NA
654,966582526,"123...Infinity (3/20)",0,266.25,"SF Carmelo Anthony F Paul George PG Dennis Schroder C DeAndre Jordan SG Nicolas Batum UTIL Kemba Walker G Eric Bledsoe PF Frank Kaminsky",NA,"","","",NA
654,967009503,"chefcurry68 (11/20)",0,266.25,"SF Paul George PF Kelly Olynyk UTIL Tyler Johnson C Nene Hilario G Lou Williams PG James Harden SG Eric Gordon F Montrezl Harrell",NA,"","","",NA
656,966588672,"Italia031 (2/4)",0,266,"F Dwight Powell SG James Harden G Eric Gordon C Montrezl Harrell PF Marvin Williams PG Kemba Walker SF Tony Snell UTIL Giannis Antetokounmpo",NA,"","","",NA
656,966874303,"IA2016 (1/2)",0,266,"SF Carmelo Anthony F Paul George C Nene Hilario SG Trevor Ariza UTIL James Harden G Eric Gordon PF Montrezl Harrell PG Eric Bledsoe",NA,"","","",NA
658,966962043,"scjeez (10/20)",0,265.75,"PF Carmelo Anthony PG Russell Westbrook F Kelly Olynyk G Tyler Johnson UTIL Nene Hilario SF P.J. Tucker C DeAndre Jordan SG Eric Gordon",NA,"","","",NA
658,967005008,"dpjr22",0,265.75,"PF Carmelo Anthony F Paul George SF Taurean Prince C Kelly Olynyk G Dennis Smith Jr. PG Lou Williams UTIL DeAndre Jordan SG Eric Gordon",NA,"","","",NA
660,966474031,"baseball0644",0,265.5,"G Raymond Felton PF Ersan Ilyasova UTIL Russell Westbrook F Taurean Prince C Dwight Powell SG Trevor Ariza PG James Harden SF Jeremy Lamb",NA,"","","",NA
660,966848619,"gfay63 (16/20)",0,265.5,"SF Paul George C Kelly Olynyk PF Bam Adebayo UTIL P.J. Tucker G Trevor Ariza SG Eric Gordon PG Austin Rivers F Giannis Antetokounmpo",NA,"","","",NA
660,966901595,"PowerTron (3/20)",0,265.5,"PG Russell Westbrook F Wayne Ellington C Nene Hilario PF P.J. Tucker SF Trevor Ariza SG James Harden G Eric Gordon UTIL Jamil Wilson",NA,"","","",NA
660,967081281,"aedwards757",0,265.5,"PF Carmelo Anthony C Steven Adams F Dirk Nowitzki G Dennis Smith Jr. UTIL P.J. Tucker SG Eric Gordon PG Kemba Walker SF Giannis Antetokounmpo",NA,"","","",NA
664,966674417,"forrestkoba (9/20)",0,265.25,"UTIL Carmelo Anthony C Steven Adams PF Kelly Olynyk SF Josh Richardson G Dennis Smith Jr. F P.J. Tucker SG Trevor Ariza PG James Harden",NA,"","","",NA
664,966922427,"tjbarefield",0,265.25,"UTIL Carmelo Anthony SF Paul George SG Wayne Ellington PF Harrison Barnes PG Dennis Smith Jr. G Kemba Walker C Frank Kaminsky F Giannis Antetokounmpo",NA,"","","",NA
666,966603932,"mapyjimmy",0,265,"F Ersan Ilyasova C Miles Plumlee G Andre Roberson SG Wayne Ellington PF P.J. Tucker PG James Harden UTIL Khris Middleton SF Giannis Antetokounmpo",NA,"","","",NA
666,966604264,"Diggy1984 (1/2)",0,265,"F Kelly Olynyk G Tyler Johnson SG Josh Richardson PF P.J. Tucker SF Trevor Ariza PG James Harden C DeAndre Jordan UTIL Montrezl Harrell",NA,"","","",NA
666,966773169,"TheeExecutive",0,265,"G Raymond Felton PG Russell Westbrook SF Paul George C Steven Adams UTIL Salah Mejri SG James Harden F Sam Dekker PF Montrezl Harrell",NA,"","","",NA
